file_path,title,summary,Category
ICOLD - CFRD New Bulletin 2023\Numerical Analysis\Fu2019_Article_AGeneralizedPlasticityModelFor.pdf,"""Generalized plasticity model for stress-strain and creep behavior of rockfill materials""","The given document discusses the modeling of stress and creep behavior in concrete face rockfill dams (CFRDs) made of rockfill materials. A generalized plasticity model is proposed and verified through experimental data for predicting deformation and stress of dams. The document includes discussions on constitutive equations for plastic strains caused by creep, parameters used in constitutive models, creep-induced plastic flow direction tensors, and stress-induced plastic flow. The text also describes studies conducted on the behavior of rockfill materials, including creep behavior, constitutive modeling, and experimental tests. Finally, there are references to various publications related to geotechnical engineering and earth and rockfill dam engineering.",Numerical Analysis
ICOLD - CFRD New Bulletin 2023\Numerical Analysis\Pang2019_Article_SeismicPerformanceAssessmentOf.pdf,"I'm sorry, but based on the information you provided, I cannot accurately guess the title of the paper. Can you provide more details or information about the paper?","The document discusses the use of fragility analysis for seismic performance assessment of high concrete face rockfill dams (CFRDs) and includes various approaches and studies related to fragility analysis for concrete dams. The use of different seismic performance assessment indices and different ground motion records for the analysis is discussed. The document also covers models used for analyzing the behavior of earth dams and the use of geotechnical engineering software for performance analysis. Overall, the document provides information on fragility analysis and its application in assessing the seismic safety of high CFRDs, including examples of failure grades, safety assessment, and grading standards used in other studies.",Numerical Analysis
ICOLD - CFRD New Bulletin 2023\Numerical Analysis\Seismic response analysis of face slabs in concrete face rockfill dams (1).pdf,Seismic response analysis of face slabs in concrete face rockfill dams,"The document discusses the behavior of concrete face slabs in concrete-faced rockfill dams (CFRDs) under seismic events, using an advanced model to simulate interface behavior. It compares the effectiveness of contact analysis and a thin-layer interface element in simulating seismic responses. The text also includes a list of references to research papers and articles on the topic of concrete-faced rockfill dams, their behavior and analysis, seismic excitation, and soil-structure interaction.",Numerical Analysis
ICOLD - CFRD New Bulletin 2023\Numerical Analysis\Seismic response analysis of face slabs in concrete face rockfill dams.pdf,Seismic response analysis of face slabs in concrete face rockfill dams.,"The document discusses studies on the behavior of concrete-faced rockfill dams (CFRDs) under seismic events and soil-structure interactions, including the interface between the concrete face slab and the cushion layer. The study examines different numerical methods and experimental observations to simulate the granular soil-structure interface and discusses the effects of various factors on the concrete slab response. The article also provides a list of academic journal articles related to geotechnical engineering and soil-structure interactions.",Numerical Analysis
ICOLD - CFRD New Bulletin 2023\Numerical Analysis\Zheng2019_Article_NumericalSimulationOfMechanica.pdf,"""Numerical simulation of mechanical characteristics of concrete face rockfill dam under complicated geological conditions""","The document discusses a study on the stress and deformation characteristics of concrete face rockfill dams under complex geological conditions using the finite element analysis method. Deformation control is important for the safety of the dam, and there is still a lot to be researched on this topic. Theoretical analysis methods and numerical simulations are used to analyze the mechanical properties of concrete and rockfill. The simulation of concrete face rockfill dams using finite element software is also discussed. The document concludes with the importance of researching concrete face rockfill dams under complex geological conditions and the need for further research using computer technology.",Numerical Analysis
ICOLD - CFRD New Bulletin 2023\Numerical Analysis\geng.11.00027.pdf,"""Three-dimensional analysis of a concrete-face rockfill dam""","The provided text is excerpts from a long document discussing the construction, behavior, and analysis of concrete-face rockfill dams (CFRDs). Topics covered include the advantages and construction of CFRDs, the behavior of the face slab, the need to consider 3D effects in the study of first reservoir filling, the design of the perimeter joint of the face slab, stresses on the face slab, and axial forces in the face slab. The text also includes information about the modeling and instrumentation of CFRDs and references to related papers.",Numerical Analysis
ICOLD - CFRD New Bulletin 2023\Numerical Analysis\geng.2006.159.1.49.pdf,"Sorry, based on the given information, the title of the paper is not specified.","The provided text consists of several sections discussing the behavior and analysis of high rockfill dams during impounding, including a case study of the Masjed-E-Soleyman rockfill dam in Iran. The document includes findings on saturation collapse, reduced arching, induced settlements, and numerical modeling using the Hardening Soil constitutive model. The text also features data, figures, and tables related to material properties, stresses, settlements, and deformation. Additionally, the document provides a list of references and guidelines for submitting articles to a geotechnical engineering journal.",Numerical Analysis
ICOLD - CFRD New Bulletin 2023\Numerical Analysis\geot2013.57753.0011.pdf,"""Modelling the response of Lechago earth and rockfill dam""","The document is about the Lechago Dam, which is an earth and rockfill structure. The dam was built on soft foundation soil and incorporated a narrow central clay core with wide rockfill shoulders. The document discusses the construction of the dam, and the testing and analysis of its behavior using laboratory tests and finite element modeling. The text describes the geology and soil characteristics of the dam site, as well as the transport, placement, and compaction of quartzitic Cambrian shales used in the dam's construction. The document includes technical information on test results and the model used for analysis, as well as discussions on the simulation and prediction of the dam's behavior during impounding. Additionally, the document includes references to academic papers and theses related to porous materials mechanics and dam construction.",Numerical Analysis
ICOLD - CFRD New Bulletin 2023\Numerical Analysis\jgeen.14.00103.pdf,Behavior of concrete-face rockfill dam on sand and gravel foundation.,"The document discusses the behavior of a specific concrete-face rockfill dam built on a sand and gravel foundation, including its construction process, seepage control system, and the effect of different construction schemes on its behavior. The paper also examines the behavior of different components of the dam, such as the cut-off wall and face slab, and presents measured and simulated results of stresses, deformations, and settlements. The authors discuss potential issues with dam construction and suggest improvements, such as using a suspended cut-off wall or choosing an appropriate construction scheme. Finally, the document contains a list of related research articles and invites submissions for the journal.",Numerical Analysis
ICOLD - CFRD New Bulletin 2023\Numerical Analysis\jgeen.19.00006.pdf,"""Plastic-damage analysis of concrete cutoff wall for a concrete face rockfill dam""","The document discusses various studies and research papers related to the behavior, construction, and analysis of different types of dams, including concrete face rockfill dams, seepage barriers, and slurry cutoff walls. It covers topics such as stress-deformation of diaphragm walls, the effectiveness of cutoff walls under hydraulic structures, and deformation and cracking of seepage barriers in dams. The document also includes references to papers and a call for contributions to a civil engineering journal.",Numerical Analysis
ICOLD - CFRD New Bulletin 2023\Numerical Analysis\jgeot.17.p.299.pdf,Grain size and time effect on the deformation of rockfill dams: a case study on the Shuibuya CFRD.,"The document discusses various aspects of rockfill dams, including challenges in predicting settlement, limitations of current models, and methods for incorporating scaling effects. It also discusses models for characterizing the behavior of rockfill and the use of laboratory tests to determine material properties. The document presents case studies of rockfill dams and includes discussions on factors such as loading cycles, particle breakage, creep, and grain size scaling. Finally, the document includes a list of references for further reading.",Numerical Analysis
ICOLD - CFRD New Bulletin 2023\Rockfill Behavior\(ASCE)0733-9410(1984)110_7(821).pdf,"""Post-construction deformation of rockfill dams""","The document discusses various studies and methods for predicting the post-construction deformations of rockfill dams, focusing on crest settlements and deflections. The effectiveness and limitations of empirical equations in predicting dam movements are explored, and an alternative approach based on comparing with similar dams is proposed. The document provides information on the construction method, loading during the post-construction period, and fill and foundation materials for several dams. Tables, equations, and charts are also provided to aid in predicting dam behavior. The text also includes references and citations from various publications related to dams and geotechnical engineering.",Rockfill Behavior
ICOLD - CFRD New Bulletin 2023\Rockfill Behavior\(ASCE)0733-9410(1987)113_1(46).pdf,"""Postconstruction Deformations of Rockfill Dams""","The document discusses post-construction deformation and settlement of rockfill dams with a central or slightly inclined core. Settlement follows three stages: initial small settlement, a substantial increase, and then a continuous decrease. The article provides insights into the behavior and monitoring of rockfill dams, including various methods to evaluate deformation and settlement. The text discusses settlements and deformations in rockfill and core materials and describes the effects of impounding on rockfill-dam deformation. It also includes graphs, data points, and references related to rockfill and earth dams.",Rockfill Behavior
ICOLD - CFRD New Bulletin 2023\Rockfill Behavior\(ASCE)1090-0241(2003)129_10(909).pdf,"""Rockfill Modulus and Settlement of Concrete Face Rockfill Dams""","The given text is a portion of a long document that discusses the properties of rockfill dams, especially dumped rockfill and concrete face rockfill dams. It includes measurements of crest settlement and time-dependent settlement rates, offers methods for estimating rockfill modulus, crest settlements, and face slab deformations. The data is based on a broad database of well-instrumented dams with detailed information on material properties and placement methods. The text also acknowledges sources of support for research on the pre- and post-failure deformation behavior of soil slopes and lists references for additional reading on the topic.",Rockfill Behavior
ICOLD - CFRD New Bulletin 2023\Rockfill Behavior\(ASCE)1090-0241(2003)129_4(307).pdf,"""Time for Development of Internal Erosion and Piping in Embankment Dams""","The document discusses the estimation of the time for progression of internal erosion and piping in embankment dams and their foundations, as well as the potential for loss of life in the event of dam failure. The process of internal erosion and piping is broken up into several phases, and tables and case studies are provided to assess the time it takes for breach formation and erosion progression. The effectiveness of monitoring programs and intervention measures is also discussed, along with various publications and sources related to assessing the probability of failure of embankment dams.",Rockfill Behavior
ICOLD - CFRD New Bulletin 2023\Rockfill Behavior\(ASCE)1090-0241(2003)129_9(785).pdf,"The title of the paper is ""Some Uncertainties in Embankment Dam Engineering"".","The provided text consists of various segments discussing issues related to the design and construction of embankment dams, including uncertainties, risk assessment, issues with material placement and segregation, the impact of weather conditions and frost, incidents of seepage, erosion, and sinkholes, and the importance of appropriate filter design and placement. The text also includes a list of references related to geotechnical and civil engineering topics.",Rockfill Behavior
ICOLD - CFRD New Bulletin 2023\Rockfill Behavior\(ASCE)GM.1943-5622.0000977.pdf,"""Particle Breakage of Rockfill Materials during Triaxial Tests""","The given document excerpts discuss various studies and tests related to particle breakage in rockfill materials under triaxial testing conditions. The studies investigate the effects of specimen preparation, consolidation, and constricting pressure on particle breakage and analyze the impact of breakage on the dilatancy, friction angle, strength, and permeability of rockfill materials used in dam engineering. The texts also include information on the behavior and deformation of rockfill materials, the limitations and factors affecting particle breakage, and various models and simulations used to analyze and understand the behavior of granular materials.",Rockfill Behavior
ICOLD - CFRD New Bulletin 2023\Rockfill Behavior\(ASCE)GM.1943-5622.0001517.pdf,"""Particle Breakage of Rockfill Material during Triaxial Tests under Complex Stress Paths""","The document discusses the behavior of rockfill materials under different stress paths during triaxial testing, and the effects of particle breakage on the structure, strength, friction angle, and permeability of the rockfill. The study investigates rockfill particle breakage under different equal stress ratio paths and transitional stress paths, and the loading stress path significantly influences particle breakage. The article includes stress-strain curves, graphs, and tables that analyze the relationship between particle breakage, plastic work, and different stress paths. The document contains references to various academic papers related to the mechanical behavior of rockfill materials under different stress conditions and loading frequencies.",Rockfill Behavior
ICOLD - CFRD New Bulletin 2023\Rockfill Behavior\(ASCE)GT.1943-5606.0001176.pdf,"""Influence of Density and Pressure on Strength and Deformation of Rockfill Material: Large-Scale Triaxial Compression Tests""","The given text includes various portions from different documents, including journal articles and reference lists, related to geotechnical engineering, specifically the behavior of rockfill and sand materials under different conditions of stress and density. The documents discuss different factors affecting the strength and deformation behaviors of the materials, including initial void ratio, initial confining pressure, density, and particle shape. Equations and graphs are provided to illustrate these relationships. The documents also mention various testing devices and loading paths used in different studies, as well as predictive and constitutive models for material behavior. Finally, the documents include reference lists of various research articles related to geotechnical and geoenvironmental engineering, covering topics such as soil mechanics, seismic analysis of dams, and construction techniques for concrete-faced rockfill dams.",Rockfill Behavior
ICOLD - CFRD New Bulletin 2023\Rockfill Behavior\(ASCE)GT.1943-5606.0001178.pdf,"""Inﬂuence of Intermediate Principal Stress on the Strength and Dilatancy Behavior of Rockﬁll Material"".","The given text contains various articles and studies related to the mechanical and physical properties, behavior, and modeling of granular materials such as rockfill and soil. The articles cover topics such as constitutive models, triaxial testing, shear strength evaluation, stress conditions, particle size and shape effects, and state-dependent behaviors. The text provides a list of references from different academic papers and journals on geotechnical engineering.",Rockfill Behavior
ICOLD - CFRD New Bulletin 2023\Rockfill Behavior\(ASCE)GT.1943-5606.0001835.pdf,"""In Situ Rockfill Compressibility: Short-Term and Long-Term Evaluation Based on Void Ratio and Parent Rock Strength""","The provided document consists of various portions discussing studies and research related to the compressibility, stress-strain behavior, and time-dependent deformation of rockfill materials used in the construction of dams and embankments. The studies evaluate the influence of several factors such as rock particle strength, void ratio, compaction effort, stress levels, and mineralogy on the mechanical behavior of rockfill during and after construction. Various parameters and equations are presented for calculating post-construction crest settlement and time-dependent compressibility. The document also includes a list of references for further research on the mechanics and behavior of rockfill dams and granular materials.",Rockfill Behavior
ICOLD - CFRD New Bulletin 2023\Rockfill Behavior\(ASCE)GT.1943-5606.0001898.pdf,"""Largescale Triaxial Experiments on the Creep Behavior of a Saturated Rockfill Material""","The document includes descriptions and results of various studies related to the mechanics and behavior of rockfill materials, including their stress dilatancy characteristics and creep behavior. The studies provide useful insights into the long-term deformation of rockfill dams and have applications for designing structures. The document contains diagrams, tables, equations, and experimental procedures used in the studies. Additionally, the document includes a list of references from various journals and conferences related to geotechnical engineering and soil mechanics.",Rockfill Behavior
ICOLD - CFRD New Bulletin 2023\Rockfill Behavior\(ASCE)GT.1943-5606.0002216.pdf,"""Investigation into the Internal Erosion and Local Settlement of Esfarayen Earth-Fill Dam""","The document discusses an investigation into a sudden settlement on the surface of the Esfarayen Earth-fill Dam caused by internal erosion due to an inadequate sealed crushed zone of a fault passing through the reservoir on the contact surface with the clay core. The text includes case studies, discussion on cut-off walls and grout curtains, subsurface exploration, material susceptibility analysis, and stress-strain behavior modeling of the dam body. Additionally, it covers the construction project, hydraulic properties, and possibility of hydraulic fracture occurrence, as well as the incident caused by the collapse of the clay core due to internal erosion. The document also provides a list of academic articles related to geotechnical engineering of dams.",Rockfill Behavior
ICOLD - CFRD New Bulletin 2023\Rockfill Behavior\An empirical method for predicting post-construction Rockfill.pdf,"""An Empirical Method for Predicting Post-Construction Settlement of Concrete Face Rockfill Dams""","The document discusses various studies and methods for predicting post-construction settlement in concrete face rockfill dams (CFRDs), taking into account factors such as the height and composition of the dam and the behavior of the embankment during construction. The text highlights the significance of understanding rockfill deformation mechanisms and offers practical methods for detecting unexpected settlement behaviors during a CFRD's post-construction lifespan. The limitations of existing settlement prediction methods are discussed, and novel approaches are proposed to overcome these limitations. The study also presents data on different case studies and provides reference to relevant articles, reports, and conference proceedings on the topic.",Rockfill Behavior
ICOLD - CFRD New Bulletin 2023\Rockfill Behavior\geot.2007.57.3.289.pdf,"""Theoretical investigation of the time-dependent behaviour of rockfill""","The document discusses the time-dependent behavior of rockfill, including its compressibility and delayed deformations. It proposes a model based on crack propagation in rock particles induced by stress corrosion mechanisms to explain the observations. The text describes experimental observations and a model of crack propagation in loaded disc-shaped particles to explain particle breakage and its relationship with time. Various constitutive models are proposed, but the document develops a conceptual model that relates delayed deformations to particle breakage. The text also includes technical terms and definitions related to various aspects of rock fill and a list of references related to the study of various aspects of soil and rock mechanics.",Rockfill Behavior
ICOLD - CFRD New Bulletin 2023\Structural Analysis\(ASCE)GM.1943-5622.0000478.pdf,"""Structural Analysis Framework for Concrete-Faced Rockfill Dams""","The text provided discusses the design and construction of concrete-faced rockfill dams (CFRDs) and the challenges associated with them. It includes details about the Kárahnjúkar CFRD, a case study used to validate a new modeling framework for predicting failure of the concrete facing. The text also mentions the importance of stage-construction analysis in CFRD projects and various mitigation measures to address potential issues. Measurements from instrumentation and settlement calculations are also presented, and a reference list is included. Overall, the text provides valuable information for designing and constructing CFRDs.",Structural Analysis
ICOLD - CFRD New Bulletin 2023\Structural Analysis\(ASCE)GM.1943-5622.0000939.pdf,"Sorry for the late response! The title of the paper is ""Concrete Slab Dynamic Damage Analysis of CFRD Based on Concrete Nonuniformity"".",The document discusses various studies related to the seismic response and damage analysis of concrete-faced rockfill dams. The studies utilize different models and parameters to analyze the behavior of concrete and rock materials under seismic loads. The nonuniformity of concrete is also considered in some of the studies. The document also provides a list of references for further reading on topics related to geotechnical engineering.,Structural Analysis
ICOLD - CFRD New Bulletin 2023\Structural Analysis\1-s2.0-S0267726119300284-main.pdf,"""Seismic Damage Performance of the Steel Fiber Reinforced Face Slab in the Concrete-Faced Rockfill Dam""","The given document includes various articles and studies related to the design and construction of concrete-faced rockfill dams, with a focus on the use of steel fiber-reinforced concrete in the face slabs to improve seismic performance and reduce damage during earthquakes. The document discusses various simulation models and tests conducted to analyze the behavior of these dams under different conditions, including drying shrinkage cracks and axial forces. Multiple references are provided for further research and analysis.",Structural Analysis
ICOLD - CFRD New Bulletin 2023\Structural Analysis\1-s2.0-S0950061820301719-main.pdf,"""Laboratory and in situ investigation of the compressive strength of CFRD concrete""","The document consists of various extracted parts discussing studies and research related to the quality and strength assessment of concrete used in constructing dams, particularly Concrete Face Rockfill Dams (CFRDs). The studies make use of nondestructive tests, such as ultrasonic pulse velocity and Schmitt hammer, to determine the compressive strength and other properties of the concrete. Various factors, including concrete and ambient temperature, concrete air percentage, and concrete slump, are considered in predicting concrete compressive strength. Numerous references are provided concerning non-destructive testing, evaluation, and risks of concrete dams.",Structural Analysis
ICOLD - CFRD New Bulletin 2023\Structural Analysis\Behaviour of the reinforced concrete face slabs of concrete faced rockfill dams during impounding.pdf,"""Behaviour of the reinforced concrete face slabs of concrete faced rockfill dams during impounding""","The document discusses a study on the cracking of the face slab of a concrete faced rockfill dam (CFRD) during impounding. The study looks at various factors affecting the cracking of the face slab and examines the behavior of rockfill material under different stress conditions. The study uses finite element software to analyze the stress and deformation patterns of the face slab in different stages, including impounding. The study finds that increasing the reinforcement ratio is the most effective way to reduce crack width, but it does not significantly change the extent of cracking. The portion also includes a list of various sources related to the design, construction, and analysis of concrete face rockfill dams.",Structural Analysis
