file_path,title,summary,Category
ICOLD - CFRD New Bulletin 2023\Dam Response\(ASCE)1090-0241(2006)132_6(778).pdf,"""Construction of Concrete-Faced Rockfill Dams with Weak Rocks""","The document discusses the use of weak rocks for the construction of concrete-faced rockfill dams (CFRDs) in China. It includes information on the physical, mechanical, and hydraulic properties of weak rocks, as well as stability and deformation analysis of the dams. The document provides details on tests conducted on weak rocks for dam construction, including permeability and compaction tests. The text also discusses measures taken to prevent crushing and crusting during construction and the importance of selecting the correct type of rock for different zones of the dam.",Dam Response
ICOLD - CFRD New Bulletin 2023\Dam Response\(ASCE)GT.1943-5606.0000021.pdf,"""Behavior of Concrete-Faced Rockfill Dams during Initial Impoundment""","The document discusses the behavior of concrete-faced rockfill dams (CFRDs) during initial impoundment and problems with their design and construction. Various experiments, tests, and numerical models are described in detail, which examine the stiffness of the face slab, transition supporting zone stiffness, and its effect on deformation. The benefits of centrifuge modeling are also mentioned. The results of centrifuge tests and numerical simulations are compared with field measurements to improve predictions of CFRD performance. The text includes references, acknowledgments, and a list of related sources.",Dam Response
ICOLD - CFRD New Bulletin 2023\Dam Response\(ASCE)GT.1943-5606.0001501.pdf,"""Localizing and Quantifying Leakage through CFRDs: A Technical Note""","The given text discusses a technical note about a method for estimating leakage rates in Concrete Faced Rockfill Dams (CFRDs) through the development of models. The note includes a case study of Buxi CFRD to illustrate the method. It discusses two types of leakage sources, horizontal and vertical, and compares the leakage rates of slender and thin-wall orifices. The text also focuses on the relationship between measured leakage and water level in the Buxi dam, identifying the elevations with significant leakage and the main sources of it. The conclusion shows good agreement between the calculated and measured leakage values.",Dam Response
ICOLD - CFRD New Bulletin 2023\Dam Response\Monitoring System.pdf,"""Development and In Situ Application of Deformation Monitoring System for Concrete-Face Rockfill Dam Using Fiber Optic Gyroscope""","The article discusses the development and implementation of a fiber optic gyroscope (FOG) monitoring system for concrete-face rockfill dams (CFRDs) to monitor deformation of the face slab. Traditional instruments have limitations, and advanced techniques have been developed for deformation change detection. The FOG system consists of a sensing vehicle that moves along a monitoring pipeline, and the data collected is used to calculate deformation using angular velocity. The system has been tested on the Shuibuya dam with good results. The text also describes the behavior of a reservoir dam and the deformation of its face slab as the water level increases. Various in situ tests on the system are discussed, and their results show that the FOG system is effective for monitoring the deformation of the dam, and can form a permanent monitoring channel for its safe operation.",Dam Response
ICOLD - CFRD New Bulletin 2023\Dam Response\feng.2011.164.1.33.pdf,Investigation of Dam Incidents and Failures.,"The document discusses the importance of investigating dam failures and incidents to improve dam safety. It mentions various incidents and failures that have occurred around the world, and lists the common causes of such incidents. The text also emphasizes the value of monitoring, maintenance, and proper investigation techniques, and stresses the need for adequate information to reach reliable conclusions. The document also highlights the importance of learning from historical dam failures to improve dam safety. There is also a discussion of incident reporting regulations and the development of databases to track dam performance. Finally, the article mentions various sources and references related to dam safety.",Dam Response
ICOLD - CFRD New Bulletin 2023\Dam Response\jdare.17.00011.pdf,"""Dams and Reservoirs: The 2016 Geoffrey Binnie Lecture: Dam Engineering – the last 50 years, the next 50 years""","The text is a review of the history of dam engineering and how it has evolved in the last 50 years. It includes discussions about advances and challenges in hydrology, dam design, and construction, including the use of computational fluid dynamics and roller-compacted concrete. The author emphasizes the importance of monitoring and predicting dam failure and the need for flexibility in standardization. The article concludes with a call for greater imagination and innovation in the future design of dams.",Dam Response
ICOLD - CFRD New Bulletin 2023\Dam Response\jgeen.17.00142.pdf,"""A statistical analysis on concrete cut-off wall behaviour""","The document discusses various studies and research related to the behavior, design, and construction of concrete cut-off walls used in dams for seepage control. It includes a statistical analysis of 43 case histories and factors affecting wall behavior, such as material, foundation deformation characteristics, and wall location. The text also discusses potential problems associated with cut-off wall construction and provides a list of relevant studies and publications.",Dam Response
ICOLD - CFRD New Bulletin 2023\Dam Response\jgeot.17.p.095.pdf,"""A statistical review of the behaviour of concrete-face rockfill dams based on case histories""","The given text excerpts discuss various aspects of the behavior, design, construction, and analysis of concrete-faced rockfill dams (CFRDs), including deformation behavior, stress observations, cracking and separation of face slabs, seepage control, and factors influencing stability. The texts also provide data, statistics, empirical relationships, and references related to estimating deformation and seepage behavior of CFRDs. There is a random sequence of characters and a mention of copyright laws in some of the texts.",Dam Response
ICOLD - CFRD New Bulletin 2023\Dam Response\sdar.64119.381.pdf,"Sorry, the paper you provided is not related to Pepper, so I cannot provide a title. Please provide the correct information or any additional context.","The text describes the design and construction of a concrete face rockfill dam in Peru as part of an irrigation project. The dam is founded on both volcanic and sedimentary rocks and granular alluvial soils overlying rockhead. The construction methodology used modern techniques and instrumentation, and the rockfill material was placed in layers and monitored for compaction and performance. The text also mentions a hydroelectric power plant project in Equatorial Guinea and a risk-based approach for assessing flood discharge values.",Dam Response
ICOLD - CFRD New Bulletin 2023\Dynamic Response\(ASCE)0733-9410(1995)121_2(185).pdf,Dynamic Response of Concrete-Faced Rockfill Dams to Strong Seismic Excitation.,"The given document discusses various studies related to the seismic response and design of concrete-faced rockfill (CFR) dams. The articles cover topics such as the importance of compacted rockfill, low permeability zones, and the design and construction of the face slab. Studies conducted on the seismic response of CFR dams indicate that while the overall integrity of the dam may not be in danger, face slabs can experience severe cracking and failure. The use of finite-element analyses and equivalent-linear viscoelastic analyses are discussed in detail. The document also includes a reference list for further reading on the topic.",Dynamic Response
ICOLD - CFRD New Bulletin 2023\Dynamic Response\(ASCE)1090-0241(2004)130_1(103).pdf,"""Nonlinear Seismic Response of Earth Dams with Canyon Interaction""","The document discusses a study on the seismic response of La Villita Dam and the effects of dam-canyon interaction and inelastic deformation of the dam on earthquake response. The study used a dam-canyon model that considered the deformability of the surrounding medium and the effects of spatial variation of seismic excitation. The article describes the nonlinear behavior of the dam material using a two-dimensional shear model based on the multiyield surface plasticity theory and analyzed its behavior during free vibrations. The methodology was applied to the La Villita Dam and compared to results from a linear analysis. The article also discusses the response of a dam to different frequencies of excitation in the frequency domain and the power spectral density and behavior of linear and nonlinear models of a dam at different locations and frequencies. The effects of nonlinearity and dam-canyon interaction are seen at different frequencies, and the shear strains in the dam behave elastically at first but become inelastic later on during excitation. The document concludes with acknowledgments, references, and concluding remarks about a study of the inelastic response of La Villita Dam to the 1985 Mexico earthquake.",Dynamic Response
ICOLD - CFRD New Bulletin 2023\Dynamic Response\1-s2.0-S0141029619335564-main.pdf,"""Fragility analysis of high CFRDs subjected to mainshock-aftershock sequences based on plastic failure""","The document is a collection of excerpts discussing the fragility of concrete-faced rockfill dams (CFRDs) under seismic activity, particularly mainshock-aftershock sequences. The authors use fragility analysis to evaluate the probability of CFRDs reaching various limit states under different combinations of mainshocks and aftershocks. The analysis focuses on the vertical deformation and damage index as engineering demand parameters, and the behavior of concrete face slabs is studied using the plastic-damage model. The study finds that aftershocks significantly increase the fragility of CFRDs, and the probability of plastic failure increases proportionally to the relative intensity of aftershocks. The excerpts also include references to other research on earthquake safety evaluation, damage assessment, fragility analysis, and seismic performance investigation of different types of dams.",Dynamic Response
ICOLD - CFRD New Bulletin 2023\Dynamic Response\1-s2.0-S0267726115000755-main.pdf,Geotechnical aspects and seismic damage of the 156-m-high Zipingpu concrete-faced rockfill dam following the Ms 8.0 Wenchuan earthquake,"The provided text discusses the Zipingpu hydraulic project and the effects of the 2008 Wenchuan earthquake on the Zipingpu Concrete-Faced Rockfill Dam in China. The document includes descriptions of the project's location, geology, seismicity, design, and construction, as well as measurements taken during and after the earthquake. Despite sustaining damage, the dam remained structurally stable and safe due to thoughtful design considerations, adequate zoning, and well-compacted rock-fill. Various references and sources are listed, most of which are in Chinese. The text emphasizes the importance of geotechnical aspects of design for high-embankment dams in seismic regions of western China.",Dynamic Response
ICOLD - CFRD New Bulletin 2023\Dynamic Response\1-s2.0-S026772611730057X-main.pdf,"""Seismic response of concrete-rockfill combination dam using large-scale shaking table tests""","The document discusses various studies related to dams and their seismic behavior under different ground motions. The studies cover topics such as the use of large-scale shaking table tests to investigate seismic response, dynamic earth pressure, deformation, and slope failure pattern. The results indicate that some aseismatic reinforcement measures should be taken at the top of the slope. The document also provides references to studies related to earth pressure on retaining walls, joint materials, particle breakage, and more.",Dynamic Response
ICOLD - CFRD New Bulletin 2023\Dynamic Response\1-s2.0-S0267726118306213-main.pdf,Seismic performance investigation of high CFRDs subjected to mainshock-aftershock sequences.,"The document discusses a study on the seismic safety of a 200-meter high concrete face rockfill dam (CFRD), focusing on the impact of mainshock-aftershock seismic sequences. The study used a 2D finite element model and conducted elastic-plastic analyses based on three damage measures (DMs). The results showed that CFRDs will experience additional damage or destruction while experiencing an aftershock, indicating that seismic design codes for CFRDs need to consider aftershock effects. The article includes figures showing the deformation, shear strain, and DI of the dam under different seismic events. Additionally, the study emphasizes the destruction caused by seismic sequences, which is greater than that caused by a single seismic event. Finally, a list of references for various studies related to the analysis and assessment of the seismic performance of concrete dams, particularly high CFRDs, is provided.",Dynamic Response
ICOLD - CFRD New Bulletin 2023\Dynamic Response\1-s2.0-S0267726118308844-main.pdf,"""Examining the seismic stress evolution in the face slab of concrete-faced rock-fill dams using dynamic centrifuge tests""","The document discusses various studies on the seismic behavior of concrete-faced rock-fill dams (CFRDs) using dynamic centrifuge testing. The studies examine stress evolution, failure modes, and deformation patterns during earthquakes. The results show variations in stress evolution patterns and indicate that CFRDs are highly dependent on geometrical and material properties as well as input motion characteristics. The studies provide insights into the seismic design of CFRDs and the need for accurate simulation configurations and constitutive models. The document also includes information about relevant references and codes for further reading.",Dynamic Response
ICOLD - CFRD New Bulletin 2023\Dynamic Response\Yao2019_Article_SeismicResponseOfHighConcreteF.pdf,Seismic response of high concrete face rockfill dams subjected to non-uniform input motion.,"The document discusses the seismic response of concrete-face rockfill dams (CFRDs) under both uniform and non-uniform ground motion input, including numerical analysis methods and simulations. The study concludes that non-uniform input should be considered in seismic design and discusses various factors that can affect the response of the dam, such as incident angle and amplification factor. The need for further research on efficient high-fidelity analysis methods, plasticity constitutive models, and wave scattering solutions for non-uniform bedrock is also mentioned. The document includes references to various research papers and sources related to seismic analysis and safety.",Dynamic Response
ICOLD - CFRD New Bulletin 2023\Geomemrane Face Concrete Dams (GFRD)\TheAdventOfGeo.pdf,"""Advantages of Using Geomembrane Faced Earth and Rock Dams (GFRD)""","The document discusses the use of synthetic materials, particularly geomembranes, as facings for dams. It covers advantages and disadvantages of different facing materials, such as concrete and synthetic options like PVC and HDPE, and discusses techniques for welding and connecting facings to the embankment structure. The document also covers issues like deformations and volume changes that can occur in rockfill dams and outlines methods for protecting facings from wind and wave damage. Overall, the document provides technical information for the use of synthetic materials in civil engineering with respect to dam construction and refurbishment.",Geomemrane Face Concrete Dams (GFRD)
ICOLD - CFRD New Bulletin 2023\Numerical Analysis\(ASCE)0733-9410(1990)116_5(822).pdf,"""Nonlinear Analysis of Concrete Face Rockfill Dam""","The given document discusses the design and construction of concrete membrane face rockfill dams and the challenges associated with it. The document includes information on finite element analysis, stress and strain calculations, and the use of material properties in the analysis of these dams. Various factors influencing the behavior of these dams, such as valley abutment slopes and creep deformations in rockfill, are also discussed. Finally, the document includes references and appendices related to the analysis and design of rockfill dams.",Numerical Analysis
ICOLD - CFRD New Bulletin 2023\Numerical Analysis\(ASCE)1090-0241(2003)129_3(206).pdf,"""Testing and Modeling Two Rockfill Materials""","The document discusses laboratory testing and constitutive modeling of rockfill materials obtained from two dam sites. The testing includes triaxial cell equipment to apply conﬁning pressure and axial load to specimens of the rockfill materials, and measuring axial and volumetric strain to determine material parameters for prototype rockfill materials. The document also discusses particle breakage during shearing and the calculation of the breakage factor Bg. The disturbed state concept (DSC) developed by Desai is used to characterize the behavior of the rockfill materials, and the Disturbance Strength Criterion (DSC) describes material response in terms of continuous and discontinuous components. Equations are provided for finding the values of disturbance parameters, stress-strain relationships, and determining the ultimate parameters. Material parameters were predicted for prototype rockfill materials using elastoplastic models, and the results were verified through field instrumentation. Several references related to soil mechanics and engineering are also included.",Numerical Analysis
ICOLD - CFRD New Bulletin 2023\Numerical Analysis\(ASCE)GT.1943-5606.0000058.pdf,"""Predicting the Behavior of an Earth and Rockfill Dam Under Construction""","The given text includes various studies and models related to the construction and behavior of dams, particularly the Lechago Earth Dam in Spain. It discusses the use of elastoplastic models for unsaturated soils and hydromechanical behavior of soils. The text includes tables describing the hydraulic, physical, and constitutive parameters of dam materials. It also covers simulations of the behavior of compacted soil in dams, including the distribution of pore water pressure and settlements along the dam axis. The text provides a list of references related to geotechnical engineering, particularly pertaining to the analysis and modeling of earth dams.",Numerical Analysis
ICOLD - CFRD New Bulletin 2023\Numerical Analysis\06743276.pdf,"""Simulation Analysis for Reinforced Concrete Face Rockfill Dam of Tuanjie Reservoir""","The document discusses a simulation analysis of a reinforced concrete face rockfill dam. The dam is analyzed under different calculation cases, and the stress and deformation values are evaluated through finite element analysis. The stress values are mainly compressive and meet the strength requirements, while displacement values are small and meet rigidity requirements. The text includes tables, contour maps, and figures with element division, showing the distribution of stress and displacement values under different cases. Two calculation paths and different design parameters are discussed in the text as well. There is a list of numbers labeled as Path 1 and Path 2, and three cases labeled as Case 2, Case 3, and Case 4, but there is no context provided for their meaning.",Numerical Analysis
ICOLD - CFRD New Bulletin 2023\Numerical Analysis\1-s2.0-S0038080616300130-main.pdf,"""Numerical simulation of soft longitudinal joints in concrete-faced rockfill dam""","The given document is a technical paper discussing the use of soft joints to reduce extrusion damage to concrete faces in high concrete-faced rockfill dams (CFRDs). The paper proposes a new generalized node-to-segment formulation for solving multi-body contact problems in CFRDs and includes a numerical analysis of the Tianshengqiao-1 CFRD project in China. The article discusses various methods for simulating contact and deformation in non-conforming meshes and introduces the use of Lagrange multipliers to represent contact tractions. The paper includes a creep model for rockfill materials and a bilinear extrusion model for describing the effect of absorbing extrusion deformation. The study finds that soft joints in the compressive zone can effectively reduce axial stress of the face slabs, and that further research is needed to fully understand the cause of extrusion damage. The paper also lists various research articles related to computational methods and analysis of concrete-faced rockfill dams.",Numerical Analysis
ICOLD - CFRD New Bulletin 2023\Numerical Analysis\1-s2.0-S0266352X14002183-main.pdf,"""Back-analysis of soil parameters of the Malutang II concrete face rockfill dam using parallel mutation particle swarm optimization""","The document discusses the challenges of accurately determining the mechanical properties of earth-rockfill dams and the use of displacement back-analysis to verify and modify soil parameters. It focuses on the back-analysis of the Malutang II concrete face rockfill dam using parallel mutation particle swarm optimization to control deformation in earth-rockfill dam design. The document describes the triaxial compression tests on rockfill materials to determine soil parameters, the calculation of displacement in a dam using FEM and the Duncan and Chang's E-B model, and the use of Particle Swarm Optimization (PSO) and a Nonlinear Mutation technique to optimize parameter values in Geotechnical Engineering. The document provides the steps for a parallel MPSO displacement back-analysis procedure and discusses the use of MPSO (multi-objective particle swarm optimization) method to back-analyze the rockfill parameters of Malutang II. The text also contains a list of references for research studies related to various topics including soil liquefaction, strength and deformation properties of rock fill, scale effect on stress and deformation of rock fill, and optimization algorithms.",Numerical Analysis
ICOLD - CFRD New Bulletin 2023\Numerical Analysis\1-s2.0-S0266352X16303263-main.pdf,"""Monitoring and numerical analysis of behaviour of Miaojiaba concrete-face rockfill dam built on river gravel foundation in China""","The document explores the behavior of Concrete Face Rockfill Dams (CFRDs) built on river gravel foundations, using a case study on the Miaojiaba CFRD in China. It includes studies on construction, deformation monitoring, numerical analysis, and material properties. The paper aims to fill a knowledge gap and provide a comprehensive understanding of CFRDs on river gravel foundations. The study provides useful insights into CFRD behavior and offers important references for design and assessment.",Numerical Analysis
ICOLD - CFRD New Bulletin 2023\Numerical Analysis\1-s2.0-S1674237019300808-main.pdf,"""Long-term deformation analysis of Shuibuya concrete face rockfill dam based on response surface method and improved genetic algorithm""","The document discusses various methods and algorithms used for back analysis of rockfill dams, specifically focusing on the response surface method. The study involves evaluating the mechanical parameters of the rockfill material and considers time-dependent effects on deformation. The text describes the methodology for using the response surface function to predict deformation in a dam structure and the use of the improved genetic algorithm to obtain optimal parameters for the minimum value of the objective function. The study demonstrates the accuracy and efficiency of the RSM for rockfill parameter back analysis. The paper includes a list of references for further study on parameter inversion, stress simulation analysis, and deformation control theory.
",Numerical Analysis
ICOLD - CFRD New Bulletin 2023\Numerical Analysis\9742961.pdf,"""Parameter Sensitivity and Inversion Analysis for a Concrete Face Rockfill Dam Based on CS-BPNN""","The document discusses several studies and methods related to the deformation behavior and mechanical analysis of rockfill material in concrete face rockfill dams. The studies include the use of various models, such as the E-ν model and Burgers model, and parametric inversion analysis through the modified Morris method and CS-BPNN algorithm. The text also includes figures and tables showing settlement and stress distributions, as well as a list of references for relevant articles. Additionally, there is a list of journals published in 2018 by Hindawi covering various engineering fields.",Numerical Analysis
ICOLD - CFRD New Bulletin 2023\Numerical Analysis\9780784482100.012.pdf,"""Numerical Simulation of Dynamic Centrifuge Tests on Concrete Faced Rockfill Dam""","The document discusses a study on the seismic behavior of concrete faced rockfill dams (CFRDs) using numerical simulation and dynamic centrifuge tests. The study investigates the influence of un/reloading rules and interface types between the concrete slab and rockfill on the dynamic behavior of the dam. The document details the properties of the rockfill and the configuration of the numerical model used in the test. The text discusses various soil models for use in nonlinear site response analyses and investigates the impact of the interface type between the rockfill and concrete face. The authors acknowledge the financial support and data provided by organizations in Turkey and South Korea. Finally, the document lists various sources related to geotechnical and geoenvironmental engineering research and publications.",Numerical Analysis
